{
  "title": "Контрагент",
  "type": "object",
  "description": "Данные юр. лица",


  
  "required": [
    "title",
    "fullTitle",
    "type"
  ],
  "properties": {
    "title": {
      "type": "string",
      "description": "Сокращенное наименование контрагента, которое будет видно в интерфейсе"
    },
    "fullTitle": {
      "type": "string",
      "description": "Полное наименование контрагента, как оно прописано в правоустанавливающих документах"
    },
    "type": {
      "description": "Тип",
      "oneOf": [
        {
          "$ref": "../props/link.json",
          "x-stoplight": {
            "id": "tj8hboxrg43sd"
          }
        },
        {
          "$ref": "../abstract/simple-list-item.json"
        }
      ]
    },
    "role": {
      "type": "array",
      "minItems": 1,
      "description": "Роль",
      "items": {
        "oneOf": [
          {
            "$ref": "../props/link.json"
          },
          {
            "$ref": "../abstract/simple-list-item.json"
          }
        ]
      }
    }
  },
  "$schema": "https://json-schema.org/draft/2020-12/schema",
  "examples": [
    {
      "title": "ООО ЛогистикПро",
      "fullTitle": "Общество с ограниченной ответственностью 'ЛогистикПро'",
      "type": {
        "id": "1a2b3c4d-5e6f-7g8h-9i0j-1k2l3m4n5o6p",
        "title": "Перевозчик"
      },
      "role": [
        {
          "id": "2b3c4d5e-6f7g-8h9i-0j1k-2l3m4n5o6p7q",
          "title": "Грузоперевозчик"
        },
        {
          "id": "3c4d5e6f-7g8h-9i0j-1k2l-3m4n5o6p7q8r",
          "title": "Экспедитор"
        }
      ]
    },
    {
      "title": "АО СкладМастер",
      "fullTitle": "Акционерное общество 'СкладМастер'",
      "type": {
        "id": "4d5e6f7g-8h9i-0j1k-2l3m-4n5o6p7q8r9s",
        "title": "Складской оператор"
      },
      "role": [
        {
          "id": "5e6f7g8h-9i0j-1k2l-3m4n-5o6p7q8r9s0t",
          "title": "Хранение"
        },
        {
          "id": "6f7g8h9i-0j1k-2l3m-4n5o-6p7q8r9s0t1u",
          "title": "Комплектация"
        }
      ]
    },
    {
      "title": "ИП Иванов А.А.",
      "fullTitle": "Индивидуальный предприниматель Иванов Алексей Александрович",
      "type": {
        "id": "7g8h9i0j-1k2l-3m4n-5o6p-7q8r9s0t1u2v",
        "title": "Индивидуальный предприниматель"
      },
      "role": [
        {
          "id": "8h9i0j1k-2l3m-4n5o-6p7q-8r9s0t1u2v3w",
          "title": "Курьер"
        }
      ]
    },
    {
      "title": "ООО ТрансЛогистика",
      "fullTitle": "Общество с ограниченной ответственностью 'ТрансЛогистика'",
      "type": {
        "id": "9i0j1k2l-3m4n-5o6p-7q8r-9s0t1u2v3w4x",
        "title": "Транспортная компания"
      },
      "role": [
        {
          "id": "0j1k2l3m-4n5o-6p7q-8r9s-0t1u2v3w4x5y",
          "title": "Международные перевозки"
        },
        {
          "id": "1k2l3m4n-5o6p-7q8r-9s0t-1u2v3w4x5y6z",
          "title": "Мультимодальные перевозки"
        }
      ]
    },
    {
      "title": "ЗАО ПродуктЛогистика",
      "fullTitle": "Закрытое акционерное общество 'ПродуктЛогистика'",
      "type": {
        "id": "2l3m4n5o-6p7q-8r9s-0t1u-2v3w4x5y6z7a",
        "title": "Дистрибьютор"
      },
      "role": [
        {
          "id": "3m4n5o6p-7q8r-9s0t-1u2v-3w4x5y6z7a8b",
          "title": "Оптовая торговля"
        },
        {
          "id": "4n5o6p7q-8r9s-0t1u-2v3w-4x5y6z7a8b9c",
          "title": "Доставка продуктов питания"
        }
      ]
    },
    {
      "title": "ООО ФармЛогистика",
      "fullTitle": "Общество с ограниченной ответственностью 'ФармЛогистика'",
      "type": {
        "id": "5o6p7q8r-9s0t-1u2v-3w4x-5y6z7a8b9c0d",
        "title": "Фармацевтический дистрибьютор"
      },
      "role": [
        {
          "id": "6p7q8r9s-0t1u-2v3w-4x5y-6z7a8b9c0d1e",
          "title": "Хранение лекарств"
        },
        {
          "id": "7q8r9s0t-1u2v-3w4x-5y6z-7a8b9c0d1e2f",
          "title": "Доставка в аптеки"
        }
      ]
    },
    {
      "title": "АО АвтоТранс",
      "fullTitle": "Акционерное общество 'АвтоТранс'",
      "type": {
        "id": "8r9s0t1u-2v3w-4x5y-6z7a-8b9c0d1e2f3g",
        "title": "Автотранспортное предприятие"
      },
      "role": [
        {
          "id": "9s0t1u2v-3w4x-5y6z-7a8b-9c0d1e2f3g4h",
          "title": "Грузоперевозки"
        },
        {
          "id": "0t1u2v3w-4x5y-6z7a-8b9c-0d1e2f3g4h5i",
          "title": "Аренда транспорта"
        }
      ]
    },
    {
      "title": "ООО ТаможняСервис",
      "fullTitle": "Общество с ограниченной ответственностью 'ТаможняСервис'",
      "type": {
        "id": "1u2v3w4x-5y6z-7a8b-9c0d-1e2f3g4h5i6j",
        "title": "Таможенный брокер"
      },
      "role": [
        {
          "id": "2v3w4x5y-6z7a-8b9c-0d1e-2f3g4h5i6j7k",
          "title": "Таможенное оформление"
        },
        {
          "id": "3w4x5y6z-7a8b-9c0d-1e2f-3g4h5i6j7k8l",
          "title": "Консультации по вопросам таможенного законодательства"
        }
      ]
    },
    {
      "title": "ЗАО ЛогистикГрупп",
      "fullTitle": "Закрытое акционерное общество 'ЛогистикГрупп'",
      "type": {
        "id": "4x5y6z7a-8b9c-0d1e-2f3g-4h5i6j7k8l9m",
        "title": "Логистическая компания"
      },
      "role": [
        {
          "id": "5y6z7a8b-9c0d-1e2f-3g4h-5i6j7k8l9m0n",
          "title": "Управление цепями поставок"
        },
        {
          "id": "6z7a8b9c-0d1e-2f3g-4h5i-6j7k8l9m0n1o",
          "title": "Оптимизация логистических процессов"
        }
      ]
    }
  ]
}