[
  {
    "title": "HLZz3o4a9wqpba",
    "fullTitle": "KB3r09L1OGjf12HlnL",
    "type": {
      "error": "Unable to resolve reference: ../props/link.json"
    },
    "role": [
      {
        "error": "Unable to resolve reference: ../props/link.json"
      },
      {
        "error": "Unable to resolve reference: ../abstract/simple-list-item.json"
      },
      {
        "error": "Unable to resolve reference: ../abstract/simple-list-item.json"
      },
      {
        "error": "Unable to resolve reference: ../abstract/simple-list-item.json"
      }
    ]
  },
  {
    "title": "lU83e0cCLWs",
    "fullTitle": "7EfHnf9",
    "type": {
      "error": "Unable to resolve reference: ../abstract/simple-list-item.json"
    },
    "role": [
      {
        "error": "Unable to resolve reference: ../abstract/simple-list-item.json"
      },
      {
        "error": "Unable to resolve reference: ../props/link.json"
      },
      {
        "error": "Unable to resolve reference: ../abstract/simple-list-item.json"
      },
      {
        "error": "Unable to resolve reference: ../props/link.json"
      }
    ]
  },
  {
    "title": "lu05EYPH",
    "fullTitle": "3r7YlPZAzd2W7",
    "type": {
      "error": "Unable to resolve reference: ../abstract/simple-list-item.json"
    },
    "role": [
      {
        "error": "Unable to resolve reference: ../props/link.json"
      },
      {
        "error": "Unable to resolve reference: ../props/link.json"
      }
    ]
  },
  {
    "title": "RYANXuVDioKup",
    "fullTitle": "lsQJCArA2LPn0r",
    "type": {
      "error": "Unable to resolve reference: ../abstract/simple-list-item.json"
    },
    "role": [
      {
        "error": "Unable to resolve reference: ../abstract/simple-list-item.json"
      },
      {
        "error": "Unable to resolve reference: ../abstract/simple-list-item.json"
      }
    ]
  },
  {
    "title": "bJD7It",
    "fullTitle": "y8vAgIjPQhL53",
    "type": {
      "error": "Unable to resolve reference: ../abstract/simple-list-item.json"
    },
    "role": [
      {
        "error": "Unable to resolve reference: ../abstract/simple-list-item.json"
      }
    ]
  },
  {
    "title": "l52NDZZZ2sRqAtBoV",
    "fullTitle": "oMHbN2ZTgHq4ZC",
    "type": {
      "error": "Unable to resolve reference: ../abstract/simple-list-item.json"
    },
    "role": [
      {
        "error": "Unable to resolve reference: ../abstract/simple-list-item.json"
      },
      {
        "error": "Unable to resolve reference: ../abstract/simple-list-item.json"
      },
      {
        "error": "Unable to resolve reference: ../props/link.json"
      },
      {
        "error": "Unable to resolve reference: ../props/link.json"
      },
      {
        "error": "Unable to resolve reference: ../props/link.json"
      }
    ]
  },
  {
    "title": "qZbtvCD",
    "fullTitle": "u0Jf2AVwI53GTrCJ",
    "type": {
      "error": "Unable to resolve reference: ../props/link.json"
    },
    "role": [
      {
        "error": "Unable to resolve reference: ../abstract/simple-list-item.json"
      },
      {
        "error": "Unable to resolve reference: ../abstract/simple-list-item.json"
      },
      {
        "error": "Unable to resolve reference: ../props/link.json"
      },
      {
        "error": "Unable to resolve reference: ../props/link.json"
      },
      {
        "error": "Unable to resolve reference: ../props/link.json"
      }
    ]
  },
  {
    "title": "9nD6Vbjy",
    "fullTitle": "Qbux9YWXE6Hx",
    "type": {
      "error": "Unable to resolve reference: ../abstract/simple-list-item.json"
    },
    "role": [
      {
        "error": "Unable to resolve reference: ../abstract/simple-list-item.json"
      },
      {
        "error": "Unable to resolve reference: ../props/link.json"
      },
      {
        "error": "Unable to resolve reference: ../abstract/simple-list-item.json"
      }
    ]
  },
  {
    "title": "dWFaeRACnhba1kUoSJMt",
    "fullTitle": "PeFJtgTb5AHdIhA",
    "type": {
      "error": "Unable to resolve reference: ../props/link.json"
    },
    "role": [
      {
        "error": "Unable to resolve reference: ../props/link.json"
      },
      {
        "error": "Unable to resolve reference: ../props/link.json"
      },
      {
        "error": "Unable to resolve reference: ../props/link.json"
      },
      {
        "error": "Unable to resolve reference: ../abstract/simple-list-item.json"
      },
      {
        "error": "Unable to resolve reference: ../props/link.json"
      }
    ]
  },
  {
    "title": "D7kFQgLe7n",
    "fullTitle": "8Ags2Zx1",
    "type": {
      "error": "Unable to resolve reference: ../props/link.json"
    },
    "role": [
      {
        "error": "Unable to resolve reference: ../props/link.json"
      },
      {
        "error": "Unable to resolve reference: ../abstract/simple-list-item.json"
      },
      {
        "error": "Unable to resolve reference: ../abstract/simple-list-item.json"
      }
    ]
  }
]